{
  "schema_version": "1.0",
  "meta": {
    "engagement": "Demo",
    "sources": [
      {
        "id": "01_kickoff_call.txt",
        "kind": "transcript",
        "label": "Oct 6 · Kickoff - Meridian Freight x AWS x Aivar"
      },
      {
        "id": "02_followup_email.eml",
        "kind": "email",
        "label": "02_followup_email.eml"
      },
      {
        "id": "03_meeting_minutes.txt",
        "kind": "document",
        "label": "03_meeting_minutes.txt"
      }
    ],
    "generated_at": "2026-10-08T05:10:48+00:00",
    "models": {
      "extraction": "us.anthropic.claude-sonnet-5-5",
      "hidden_signals": "us.anthropic.claude-opus-5-5"
    },
    "review_status": "pending human review"
  },
  "what_we_heard": {
    "goals": [
      {
        "id": "H-1",
        "text": "Invoices that are clean are matched automatically, leaving a short list of real exceptions for the team to review.",
        "tag": "stated",
        "evidence": [
          {
            "source": "01_kickoff_call.txt",
            "quote": "Invoices matched automatically when they are clean, and a short list of real exceptions for the team to look at.",
            "speaker": "Marcus Obi"
          }
        ]
      },
      {
        "id": "H-2",
        "text": "A clear record of who approved what.",
        "tag": "stated",
        "evidence": [
          {
            "source": "01_kickoff_call.txt",
            "quote": "I also want a clear record of who approved what.",
            "speaker": "Marcus Obi"
          }
        ]
      },
      {
        "id": "H-3",
        "text": "Look at supplier onboarding next if the invoice work goes well.",
        "tag": "stated",
        "evidence": [
          {
            "source": "02_followup_email.eml",
            "quote": "supplier onboarding is taking us far too long, and if the invoice work goes well I would like to look at it next.",
            "speaker": "Marcus Obi"
          }
        ]
      },
      {
        "id": "H-4",
        "text": "Reduce dependency on a single person for exception tracking.",
        "tag": "inferred",
        "evidence": [
          {
            "source": "01_kickoff_call.txt",
            "quote": "Raj keeps a spreadsheet of the open exceptions, uh, and honestly nobody else really touches it.",
            "speaker": "Dana Whitfield"
          }
        ]
      }
    ],
    "pain_points": [
      {
        "id": "H-5",
        "text": "Exceptions (price differences, missing receipts) take about five days and are worse at month end; they are what keep the team late.",
        "tag": "stated",
        "evidence": [
          {
            "source": "01_kickoff_call.txt",
            "quote": "For anything with an exception, a price difference or a missing receipt, it is closer to five days, and at month end it is worse.",
            "speaker": "Marcus Obi"
          },
          {
            "source": "02_followup_email.eml",
            "quote": "The exceptions are what keep the team late at month end, and nobody has measured exactly how many there are.",
            "speaker": "Marcus Obi"
          }
        ]
      },
      {
        "id": "H-6",
        "text": "Open exceptions are tracked in one person's spreadsheet that nobody else touches; when he is out, people are chased by email.",
        "tag": "stated",
        "evidence": [
          {
            "source": "01_kickoff_call.txt",
            "quote": "Raj keeps a spreadsheet of the open exceptions, uh, and honestly nobody else really touches it.",
            "speaker": "Dana Whitfield"
          },
          {
            "source": "01_kickoff_call.txt",
            "quote": "We chase people by email until he is back. It has happened a couple of times.",
            "speaker": "Dana Whitfield"
          }
        ]
      },
      {
        "id": "H-7",
        "text": "The approval trail had to be rebuilt from emails when auditors asked.",
        "tag": "stated",
        "evidence": [
          {
            "source": "01_kickoff_call.txt",
            "quote": "Our auditors asked about approvals last quarter, and honestly we had to rebuild the trail from emails.",
            "speaker": "Dana Whitfield"
          }
        ]
      },
      {
        "id": "H-8",
        "text": "A previous RPA bot broke whenever the supplier portal changed layout and was switched off.",
        "tag": "stated",
        "evidence": [
          {
            "source": "01_kickoff_call.txt",
            "quote": "It broke every time the supplier portal changed its layout, so we switched it off.",
            "speaker": "Marcus Obi"
          }
        ]
      },
      {
        "id": "H-9",
        "text": "The approval threshold list lives in a SharePoint document that is not always up to date.",
        "tag": "stated",
        "evidence": [
          {
            "source": "03_meeting_minutes.txt",
            "quote": "the current list lives in a SharePoint document that is not always up to date.",
            "speaker": "Tom Becker"
          }
        ]
      },
      {
        "id": "H-10",
        "text": "Previous automation failed because it relied on screen layout, which may make the customers wary of brittle approaches.",
        "tag": "inferred",
        "evidence": [
          {
            "source": "01_kickoff_call.txt",
            "quote": "It broke every time the supplier portal changed its layout, so we switched it off.",
            "speaker": "Marcus Obi"
          }
        ]
      }
    ],
    "current_state": [
      {
        "id": "H-11",
        "text": "Invoices mostly arrive by email in a shared mailbox, are keyed into NetSuite, then matched against the purchase order and goods receipt.",
        "tag": "stated",
        "evidence": [
          {
            "source": "01_kickoff_call.txt",
            "quote": "most of those arrive by email into a shared mailbox, ap-invoices. Somebody opens each one, keys it into NetSuite",
            "speaker": "Dana Whitfield"
          }
        ]
      },
      {
        "id": "H-12",
        "text": "Accounts payable team of three people processing about 4,500 invoices a month; later stated as closer to 5,200 in a busy month.",
        "tag": "stated",
        "evidence": [
          {
            "source": "01_kickoff_call.txt",
            "quote": "Our accounts payable team is three people, and we process about 4,500 invoices a month.",
            "speaker": "Marcus Obi"
          },
          {
            "source": "02_followup_email.eml",
            "quote": "We are now closer to 5,200 invoices in a busy month, not 4,500",
            "speaker": "Marcus Obi"
          }
        ]
      },
      {
        "id": "H-13",
        "text": "Clean invoices take about two days from arrival to approval.",
        "tag": "stated",
        "evidence": [
          {
            "source": "01_kickoff_call.txt",
            "quote": "for a clean invoice it is about two days from arrival to approval. That is fine for us.",
            "speaker": "Dana Whitfield"
          }
        ]
      },
      {
        "id": "H-14",
        "text": "NetSuite is the system of record; the supplier portal has no API and only provides a weekly CSV export.",
        "tag": "stated",
        "evidence": [
          {
            "source": "01_kickoff_call.txt",
            "quote": "NetSuite is our system of record for invoices and purchase orders. The supplier portal is a separate vendor product and it has no API",
            "speaker": "Lena Kowalski"
          }
        ]
      },
      {
        "id": "H-15",
        "text": "About 60 open exceptions are tracked at any time and the spreadsheet is updated by hand every morning.",
        "tag": "stated",
        "evidence": [
          {
            "source": "03_meeting_minutes.txt",
            "quote": "He tracks about 60 open exceptions at any time and updates it by hand every morning.",
            "speaker": "Tom Becker"
          }
        ]
      },
      {
        "id": "H-16",
        "text": "There is no vendor API in sight for the supplier portal.",
        "tag": "inferred",
        "evidence": [
          {
            "source": "03_meeting_minutes.txt",
            "quote": "A request to the portal vendor for an API has been open for a year with no answer.",
            "speaker": "Tom Becker"
          }
        ]
      }
    ],
    "constraints": [
      {
        "id": "H-17",
        "text": "A new tool cannot get direct write access to NetSuite without a security review that takes a few weeks to schedule.",
        "tag": "stated",
        "evidence": [
          {
            "source": "01_kickoff_call.txt",
            "quote": "we cannot give a new tool direct write access to NetSuite without a security review, which usually takes our team a few weeks to schedule.",
            "speaker": "Lena Kowalski"
          },
          {
            "source": "02_followup_email.eml",
            "quote": "our security review for any new NetSuite integration needs to be requested early.",
            "speaker": "Marcus Obi"
          }
        ]
      },
      {
        "id": "H-18",
        "text": "The weekly CSV export is the only supplier portal data feed; an API request to the vendor has been open for a year without an answer.",
        "tag": "stated",
        "evidence": [
          {
            "source": "03_meeting_minutes.txt",
            "quote": "A request to the portal vendor for an API has been open for a year with no answer.",
            "speaker": "Tom Becker"
          }
        ]
      },
      {
        "id": "H-19",
        "text": "Approval thresholds differ by supplier category.",
        "tag": "stated",
        "evidence": [
          {
            "source": "03_meeting_minutes.txt",
            "quote": "approval thresholds differ by supplier category",
            "speaker": "Tom Becker"
          }
        ]
      },
      {